{
  "schema_version": "1.0",
  "contract_version": "TRUST_PRODUCTION_EXECUTION_AUTHORIZATION_REVIEW_V1",
  "stage": "PEB-4A",
  "mode": "PRODUCTION_EXECUTION_AUTHORIZATION_REVIEW",
  "review_id": "PEB4A-PRODUCTION-AUTHORIZATION-20260823",
  "generated_at": "2026-08-23T08:02:00Z",
  "project_id": "Project_Intelligence_Engine",
  "source_main_sha": "19922fc7148d73ce3d8d686858582da560f915c5",
  "production_boundary_authorized": true,
  "production_execution_authorized": false,
  "automation_authorized": false,
  "pilot_authorized": false,
  "boundary_authorization": {
    "required": true,
    "basis": "EXPLICIT_HUMAN_PRODUCTION_BOUNDARY_AUTHORIZATION",
    "authorization_id": "human-peb4a-20260823-proceed",
    "authorization_ref": "conversation:2026-08-23:user-proceed-after-peb3e-closeout"
  },
  "effect_authorization": {
    "required": true,
    "authorized": false,
    "authorization_id": null,
    "authorization_ref": null,
    "bound_request_sha256": null
  },
  "request": {
    "environment": "PRODUCTION",
    "trust_report_id": null,
    "trust_report_sha256": null,
    "trust_risk_band": null,
    "target_provider": null,
    "target_resource": null,
    "capability_class": null,
    "operation": null,
    "rollback_operation": null,
    "action_payload_sha256": null,
    "target_precondition_fingerprint": null,
    "credential_scope_evidence_ref": null,
    "rollback_evidence_ref": null,
    "postcondition_verifier_ref": null,
    "blast_radius_evidence_ref": null,
    "kill_switch_evidence_ref": null,
    "recovery_window_evidence_ref": null
  },
  "preconditions": {
    "source_head_exact": true,
    "trust_decision_bound": false,
    "target_nominated": false,
    "operation_nominated": false,
    "action_payload_bound": false,
    "target_precondition_bound": false,
    "credential_scope_proven": false,
    "rollback_proven": false,
    "postcondition_verifier_proven": false,
    "blast_radius_bounded": false,
    "kill_switch_proven": false,
    "recovery_window_proven": false
  },
  "blockers": [
    "PRODUCTION_ACTION_PAYLOAD_NOT_BOUND",
    "PRODUCTION_BLAST_RADIUS_NOT_BOUNDED",
    "PRODUCTION_CREDENTIAL_SCOPE_NOT_PROVEN",
    "PRODUCTION_KILL_SWITCH_NOT_PROVEN",
    "PRODUCTION_OPERATION_NOT_NOMINATED",
    "PRODUCTION_POSTCONDITION_VERIFIER_NOT_PROVEN",
    "PRODUCTION_RECOVERY_WINDOW_NOT_PROVEN",
    "PRODUCTION_ROLLBACK_NOT_PROVEN",
    "PRODUCTION_TARGET_NOT_NOMINATED",
    "PRODUCTION_TARGET_PRECONDITION_NOT_BOUND",
    "TRUST_DECISION_BINDING_NOT_PROVEN"
  ],
  "status": "BLOCKED",
  "next_step": "NOMINATE_PRODUCTION_TARGET_AND_COMPLETE_SAFETY_EVIDENCE",
  "request_sha256": null,
  "report_sha256": "305ed723f3215906f8c025523f7c5a13ac57ede99b96fc934beb71ea899e53e3"
}
